source,event_id,year,division,round,puzzle_pieces,time_limit_seconds,rank,competitor_name,origin,time_seconds,completed,pieces_completed
usajigsaw,usajpa_2025_individual,2025,individual,final,500,5400,200,Norah Molina California,California,5247.0,True,
usajigsaw,usajpa_2025_pairs,2025,pairs,final,1000,7200,1,Kelly Walter Andrea Peng Phoenix (Arizona) / San Francisco (California),Phoenix (Arizona) / San Francisco (California),1939.0,True,
usajigsaw,usajpa_2025_pairs,2025,pairs,final,1000,7200,2,Josh Trauger Conner DeLaat Cincinnati (OH),Cincinnati (OH),1996.0,True,
usajigsaw,usajpa_2025_pairs,2025,pairs,final,1000,7200,3,Jeanne Roiter Cathy Roiter Duvall (Washington),Duvall (Washington),2055.0,True,
usajigsaw,usajpa_2025_pairs,2025,pairs,final,1000,7200,4,Sarah Schuler Lauren Kautz St. Paul (Minnesota) / Minneapolis (Mn),St. Paul (Minnesota) / Minneapolis (Mn),2079.0,True,
usajigsaw,usajpa_2025_pairs,2025,pairs,final,1000,7200,5,Elizabeth Caron Michaela Keener Hartford (Connecticut) / Lexington (Kentucky),Hartford (Connecticut) / Lexington (Kentucky),2128.0,True,
usajigsaw,usajpa_2025_pairs,2025,pairs,final,1000,7200,6,Alice Rowe Hannah Scott Boulder (Co) / Herndon (Virginia),Boulder (Co) / Herndon (Virginia),2134.0,True,
usajigsaw,usajpa_2025_pairs,2025,pairs,final,1000,7200,7,Emma Pan Min-Yee Deng West Roxbury (Massachusetts) / San Diego (Ca),West Roxbury (Massachusetts) / San Diego (Ca),2145.0,True,
usajigsaw,usajpa_2025_pairs,2025,pairs,final,1000,7200,8,Christopher Nammour Hannah Doyle Palo Alto (CA) / San Mateo (California),Palo Alto (CA) / San Mateo (California),2238.0,True,
usajigsaw,usajpa_2025_pairs,2025,pairs,final,1000,7200,9,Mari Black Hanna Sigler Cambridge (Massachusetts) / Normal (Il),Cambridge (Massachusetts) / Normal (Il),2293.0,True,
usajigsaw,usajpa_2025_pairs,2025,pairs,final,1000,7200,10,Emily Chandran Sammy Brownlow North Attleborough (Massachusetts) / Westport (Ct),North Attleborough (Massachusetts) / Westport (Ct),2318.0,True,
usajigsaw,usajpa_2025_pairs,2025,pairs,final,1000,7200,11,Rebecca Streitz Jessica Streitz Sunnyvale (California) / Philadelphia (Pa),Sunnyvale (California) / Philadelphia (Pa),2334.0,True,
usajigsaw,usajpa_2025_pairs,2025,pairs,final,1000,7200,12,Simmie Berman Tiffany Medeiros Rockville (Maryland) / Lowell (Massachusetts),Rockville (Maryland) / Lowell (Massachusetts),2340.0,True,
usajigsaw,usajpa_2025_pairs,2025,pairs,final,1000,7200,13,Kelly Buhr Jessa Douglas Soquel (California) / Centralia (Wa),Soquel (California) / Centralia (Wa),2341.0,True,
usajigsaw,usajpa_2025_pairs,2025,pairs,final,1000,7200,14,Annabelle Platt Emma Williamson (MA),(MA),2374.0,True,
usajigsaw,usajpa_2025_pairs,2025,pairs,final,1000,7200,15,Andrea Heistand Allie Arendell Muskegon (Michigan) / Honolulu (HI),Muskegon (Michigan) / Honolulu (HI),2375.0,True,
usajigsaw,usajpa_2025_pairs,2025,pairs,final,1000,7200,16,Sophie Figura Max Figura Waverly (Iowa),Waverly (Iowa),2453.0,True,
usajigsaw,usajpa_2025_pairs,2025,pairs,final,1000,7200,17,Andrea Kyle Dawne Rasmusson Saint Paul (Minnesota) / Prior Lake (Minnesota),Saint Paul (Minnesota) / Prior Lake (Minnesota),2487.0,True,
usajigsaw,usajpa_2025_pairs,2025,pairs,final,1000,7200,18,Chloe Glikbarg Skye Vandeleest San Francisco (CA),San Francisco (CA),2488.0,True,
usajigsaw,usajpa_2025_pairs,2025,pairs,final,1000,7200,19,Kyle Kossin Mathew Nettlow Bountiful (Utah) / Mableton (GA),Bountiful (Utah) / Mableton (GA),2512.0,True,
usajigsaw,usajpa_2025_pairs,2025,pairs,final,1000,7200,20,Kaitlyn McCluskie Rose Barrett Toronto (On) / Columbus (OH),Toronto (On) / Columbus (OH),2567.0,True,
usajigsaw,usajpa_2025_pairs,2025,pairs,final,1000,7200,21,Grayson Shannon Karen Brownlow Norton (MA) / Westport (CT),Norton (MA) / Westport (CT),2578.0,True,
usajigsaw,usajpa_2025_pairs,2025,pairs,final,1000,7200,22,Iryna Shvydchenko Rachael Schachtler Toronto (Ontario) / Washington (Dc),Toronto (Ontario) / Washington (Dc),2603.0,True,
usajigsaw,usajpa_2025_pairs,2025,pairs,final,1000,7200,23,Xin Li Phuah Beatrice Endler Beaverton (OR) / Portland (Or),Beaverton (OR) / Portland (Or),2604.0,True,
usajigsaw,usajpa_2025_pairs,2025,pairs,final,1000,7200,24,Cosmo Smith Leslie Richardson Seattle (Wa),Seattle (Wa),2605.0,True,
usajigsaw,usajpa_2025_pairs,2025,pairs,final,1000,7200,25,Elizabeth McElveen Jasper Lee Greenville (Sc) / Decatur (Georgia),Greenville (Sc) / Decatur (Georgia),2669.0,True,
usajigsaw,usajpa_2025_pairs,2025,pairs,final,1000,7200,26,Tammy McLeod Yvonne Feucht Los Angeles (California) / Burbank (California),Los Angeles (California) / Burbank (California),2675.0,True,
usajigsaw,usajpa_2025_pairs,2025,pairs,final,1000,7200,27,Jessica Graber Caryn Knill Saint Augustine (Florida) / St Augustine (Florida),Saint Augustine (Florida) / St Augustine (Florida),2684.0,True,
usajigsaw,usajpa_2025_pairs,2025,pairs,final,1000,7200,27,Karen Ni Carmen Dueñas Diamond Bar (California) / Woburn (Ma),Diamond Bar (California) / Woburn (Ma),2684.0,True,
usajigsaw,usajpa_2025_pairs,2025,pairs,final,1000,7200,29,Kelsi Cook Calie Curran Conroe (Tx),Conroe (Tx),2702.0,True,
usajigsaw,usajpa_2025_pairs,2025,pairs,final,1000,7200,30,Gail McCormick Maud Dias State College (Pennsylvania) / Highland Park (New Jersey),State College (Pennsylvania) / Highland Park (New Jersey),2762.0,True,
usajigsaw,usajpa_2025_pairs,2025,pairs,final,1000,7200,31,Doug Ellwanger Lindsay Steenstra San Mateo (California) / San Diego (California),San Mateo (California) / San Diego (California),2768.0,True,
usajigsaw,usajpa_2025_pairs,2025,pairs,final,1000,7200,32,Margaret Long Kayla Berkowitz Duluth (GA) / San Diego (Ca),Duluth (GA) / San Diego (Ca),2777.0,True,
usajigsaw,usajpa_2025_pairs,2025,pairs,final,1000,7200,33,Hiromi Kimura Lena Nguyen-Vo Lynnwood (WA) / Monroe (Washington),Lynnwood (WA) / Monroe (Washington),2779.0,True,
usajigsaw,usajpa_2025_pairs,2025,pairs,final,1000,7200,34,Jen Lunsford Sabrina Monserate-Lindsay Efland (NC),Efland (NC),2798.0,True,
usajigsaw,usajpa_2025_pairs,2025,pairs,final,1000,7200,35,Elizabeth Nelson Joshua Nelson Brooklyn Park (Mn) / Minneapolis (Mn),Brooklyn Park (Mn) / Minneapolis (Mn),2823.0,True,
usajigsaw,usajpa_2025_pairs,2025,pairs,final,1000,7200,36,Jessica Henderson Nicholas Mueller Columbus (Oh),Columbus (Oh),2824.0,True,
usajigsaw,usajpa_2025_pairs,2025,pairs,final,1000,7200,37,Tally Klinefelter Jasmine Butcher Lilburn (Georgia) / Fayetteville (Ga),Lilburn (Georgia) / Fayetteville (Ga),2855.0,True,
usajigsaw,usajpa_2025_pairs,2025,pairs,final,1000,7200,38,Megan Jones Melinda Whiting Provo (Ut) / Cottonwood Heights (Utah),Provo (Ut) / Cottonwood Heights (Utah),2860.0,True,
usajigsaw,usajpa_2025_pairs,2025,pairs,final,1000,7200,39,Jane Stine Jenna Chevy Chase (Md),Chevy Chase (Md),2868.0,True,
usajigsaw,usajpa_2025_pairs,2025,pairs,final,1000,7200,39,Amy Paull Alexx Cisotto The Woodlands (Texas) / Houston (Texas),The Woodlands (Texas) / Houston (Texas),2868.0,True,
usajigsaw,usajpa_2025_pairs,2025,pairs,final,1000,7200,41,Alison Filley Andrea Reynolds Iowa City (IA) / Ypsilanti (Mi),Iowa City (IA) / Ypsilanti (Mi),2870.0,True,
usajigsaw,usajpa_2025_pairs,2025,pairs,final,1000,7200,42,Grey Rogers Katherine Dilks Shreveport (Louisiana) / Haddonfield (New Jersey),Shreveport (Louisiana) / Haddonfield (New Jersey),2876.0,True,
usajigsaw,usajpa_2025_pairs,2025,pairs,final,1000,7200,43,Sarah Craig Edith Lewis Cincinnati (Ohio),Cincinnati (Ohio),2881.0,True,
usajigsaw,usajpa_2025_pairs,2025,pairs,final,1000,7200,44,Elizaveta Gallagher Ashlyn Koga Brooklyn (New York),Brooklyn (New York),2909.0,True,
usajigsaw,usajpa_2025_pairs,2025,pairs,final,1000,7200,45,Melynda Owens Jessica Musser Hurst (Texas) / North Richland Hills (Tx),Hurst (Texas) / North Richland Hills (Tx),2912.0,True,
usajigsaw,usajpa_2025_pairs,2025,pairs,final,1000,7200,46,Betsey English Brenna Kitchen Clinton (UT),Clinton (UT),2921.0,True,
usajigsaw,usajpa_2025_pairs,2025,pairs,final,1000,7200,47,Kate Yee Anna Pogharian Illinois,Illinois,2922.0,True,
usajigsaw,usajpa_2025_pairs,2025,pairs,final,1000,7200,48,Jennifer Sipple Sydney Richards Longmont (CO),Longmont (CO),2926.0,True,
usajigsaw,usajpa_2025_pairs,2025,pairs,final,1000,7200,49,Alexandra Michonski Caitlyn Helmore Harrisonburg (Virginia),Harrisonburg (Virginia),2957.0,True,
usajigsaw,usajpa_2025_pairs,2025,pairs,final,1000,7200,50,Trisha Siedlecki Allyson Longo Walnut (California),Walnut (California),2970.0,True,
usajigsaw,usajpa_2025_pairs,2025,pairs,final,1000,7200,51,Jessica Derby Liz Walters Minneapolis (Minnesota) / Crystal (MN),Minneapolis (Minnesota) / Crystal (MN),2974.0,True,
usajigsaw,usajpa_2025_pairs,2025,pairs,final,1000,7200,52,Elizabeth Forsyth Caroline Orsi sunnyvale (CA) / San Francisco (Ca),sunnyvale (CA) / San Francisco (Ca),2994.0,True,
usajigsaw,usajpa_2025_pairs,2025,pairs,final,1000,7200,53,Cas Hruska Sam Zucker Pittsburgh (Pennsylvania) / Landenberg (Pennsylvania),Pittsburgh (Pennsylvania) / Landenberg (Pennsylvania),2996.0,True,
usajigsaw,usajpa_2025_pairs,2025,pairs,final,1000,7200,54,Michelle Chan Kailee Chan Houston (Texas) / Houton (Texas),Houston (Texas) / Houton (Texas),3103.0,True,
usajigsaw,usajpa_2025_pairs,2025,pairs,final,1000,7200,55,Ashley Bromiley Soon Kim Union City (New Jersey) / germantown (md),Union City (New Jersey) / germantown (md),3107.0,True,
usajigsaw,usajpa_2025_pairs,2025,pairs,final,1000,7200,56,Alyssa Zackler Maria Seitz Stevenson Ranch (California) / Boyertown (PA),Stevenson Ranch (California) / Boyertown (PA),3108.0,True,
usajigsaw,usajpa_2025_pairs,2025,pairs,final,1000,7200,57,Nicholas Ebelhack Nathan Biberdorf Indianapolis (IN),Indianapolis (IN),3117.0,True,
usajigsaw,usajpa_2025_pairs,2025,pairs,final,1000,7200,58,Elizabeth Alvarez Maddie Bouchie (illinois) / Chicago (IL),(illinois) / Chicago (IL),3118.0,True,
usajigsaw,usajpa_2025_pairs,2025,pairs,final,1000,7200,59,Aloysia Larson Emmie Lee Grand Forks (ND) / Big Lake (MN),Grand Forks (ND) / Big Lake (MN),3123.0,True,
usajigsaw,usajpa_2025_pairs,2025,pairs,final,1000,7200,60,Darya Leylian Yuewen Chun Calabasas (CA) / Signal Hill (CA),Calabasas (CA) / Signal Hill (CA),3129.0,True,
usajigsaw,usajpa_2025_pairs,2025,pairs,final,1000,7200,61,Timothy Miller Sarah Goodman New York (NY) / St. Louis (Missouri),New York (NY) / St. Louis (Missouri),3160.0,True,
usajigsaw,usajpa_2025_pairs,2025,pairs,final,1000,7200,61,Samantha Saake Toni MacReynolds Greensboro (NC),Greensboro (NC),3160.0,True,
usajigsaw,usajpa_2025_pairs,2025,pairs,final,1000,7200,61,Angela Harrow Claire Murtha Elkins Park (PA),Elkins Park (PA),3160.0,True,
usajigsaw,usajpa_2025_pairs,2025,pairs,final,1000,7200,64,Charese Gainor Lauren Turner Bellingham (Wa),Bellingham (Wa),3161.0,True,
usajigsaw,usajpa_2025_pairs,2025,pairs,final,1000,7200,65,Amber Whitear Shalise Hassing Layton (Utah) / Syracuse (UT),Layton (Utah) / Syracuse (UT),3166.0,True,
usajigsaw,usajpa_2025_pairs,2025,pairs,final,1000,7200,66,Stephanie McIntyre Mary Beth Harris Brighton (Missouri),Brighton (Missouri),3169.0,True,
usajigsaw,usajpa_2025_pairs,2025,pairs,final,1000,7200,67,Chelsea Suedkamp Jessica Xiong Fridley (Mn),Fridley (Mn),3178.0,True,
usajigsaw,usajpa_2025_pairs,2025,pairs,final,1000,7200,68,Elizabeth Tashiro Andrew Bradburn Rancho Santa Margarita (CA) / North Hollywood (California),Rancho Santa Margarita (CA) / North Hollywood (California),3193.0,True,
usajigsaw,usajpa_2025_pairs,2025,pairs,final,1000,7200,69,Sarah Hauge Meagan Brucker-Hahn Castle Rock (CO) / Ann Arbor (Michigan),Castle Rock (CO) / Ann Arbor (Michigan),3202.0,True,
usajigsaw,usajpa_2025_pairs,2025,pairs,final,1000,7200,70,Jasmine Lambert Jared Steele Abingdon (Va),Abingdon (Va),3212.0,True,
usajigsaw,usajpa_2025_pairs,2025,pairs,final,1000,7200,71,Grace Byrnes Marguerite Byrnes Everett (Wa),Everett (Wa),3215.0,True,
usajigsaw,usajpa_2025_pairs,2025,pairs,final,1000,7200,72,Maggie Kirkland Marisa Martin Portland (OR),Portland (OR),3240.0,True,
usajigsaw,usajpa_2025_pairs,2025,pairs,final,1000,7200,73,Kylie Ledingham Krinda Hie Carmel (IN),Carmel (IN),3241.0,True,
usajigsaw,usajpa_2025_pairs,2025,pairs,final,1000,7200,74,Jennifer Luscher Katie Luscher Annapolis (Maryland),Annapolis (Maryland),3257.0,True,
usajigsaw,usajpa_2025_pairs,2025,pairs,final,1000,7200,75,Noelle Marshall Sarah Oman Thomas Lane (Mn) / Corvallis (OR),Thomas Lane (Mn) / Corvallis (OR),3262.0,True,
usajigsaw,usajpa_2025_pairs,2025,pairs,final,1000,7200,76,Julia Conn Marissa Conn Broomfield (Colorado),Broomfield (Colorado),3267.0,True,
usajigsaw,usajpa_2025_pairs,2025,pairs,final,1000,7200,77,Diana Jaffe Anne Marie Barrette Millbrae (CA),Millbrae (CA),3270.0,True,
usajigsaw,usajpa_2025_pairs,2025,pairs,final,1000,7200,78,Carley lauer Jason Pipkin Cincinnati (Ohio),Cincinnati (Ohio),3275.0,True,
usajigsaw,usajpa_2025_pairs,2025,pairs,final,1000,7200,79,Kerry Nicholson Valentina Chamorro (Massachusetts),(Massachusetts),3296.0,True,
usajigsaw,usajpa_2025_pairs,2025,pairs,final,1000,7200,80,Whitney Presley Claire Thomas Denver (Columbia) / Wheat Ridge (Co),Denver (Columbia) / Wheat Ridge (Co),3297.0,True,
usajigsaw,usajpa_2025_pairs,2025,pairs,final,1000,7200,81,Ashley Wu Emilee Frost (WA) / Arlington (Wa),(WA) / Arlington (Wa),3311.0,True,
usajigsaw,usajpa_2025_pairs,2025,pairs,final,1000,7200,82,Christine Durkin Meredith Yeager Powell (OH) / Cuyahoga Falls (Oh),Powell (OH) / Cuyahoga Falls (Oh),3323.0,True,
usajigsaw,usajpa_2025_pairs,2025,pairs,final,1000,7200,83,Jeremy Seidling Kara Taylor St Paul (MN) / Okoboji (Iowa),St Paul (MN) / Okoboji (Iowa),3328.0,True,
usajigsaw,usajpa_2025_pairs,2025,pairs,final,1000,7200,84,Chloe Ryan Denver (Colorado),Denver (Colorado),3332.0,True,
usajigsaw,usajpa_2025_pairs,2025,pairs,final,1000,7200,85,Jodi Nichol Karen Gwilliam Salt Lake City (UT) / Saratoga Springs (UT),Salt Lake City (UT) / Saratoga Springs (UT),3345.0,True,
usajigsaw,usajpa_2025_pairs,2025,pairs,final,1000,7200,86,Natalie Schimmelbusch Elizabeth Sondag Manassas (VA) / Herndon (VA),Manassas (VA) / Herndon (VA),3346.0,True,
usajigsaw,usajpa_2025_pairs,2025,pairs,final,1000,7200,87,Kristin Jimenez Melissa Harlow Berwyn (IL),Berwyn (IL),3375.0,True,
usajigsaw,usajpa_2025_pairs,2025,pairs,final,1000,7200,88,Kristin Blair Arianne Collopy Denver (CO),Denver (CO),3383.0,True,
usajigsaw,usajpa_2025_pairs,2025,pairs,final,1000,7200,89,Andrea Smith Kristin Welch Silver Spring (MD),Silver Spring (MD),3387.0,True,
usajigsaw,usajpa_2025_pairs,2025,pairs,final,1000,7200,90,Michelle McCrea Katherine McCrea Landenberg (PA),Landenberg (PA),3394.0,True,
usajigsaw,usajpa_2025_pairs,2025,pairs,final,1000,7200,91,"Eric Goulet Lindsay Wang Washington, Dc (Dc) / Arlington (Va)","Washington, Dc (Dc) / Arlington (Va)",3417.0,True,
usajigsaw,usajpa_2025_pairs,2025,pairs,final,1000,7200,92,"Kevin Erickson Katie Erickson Coon Rapids, MN 55448 (mn)","Coon Rapids, MN 55448 (mn)",3418.0,True,
usajigsaw,usajpa_2025_pairs,2025,pairs,final,1000,7200,93,Larry Blanck Meri Cartee Warminster (Pennsylvania) / Saint Peters (Missouri),Warminster (Pennsylvania) / Saint Peters (Missouri),3429.0,True,
usajigsaw,usajpa_2025_pairs,2025,pairs,final,1000,7200,94,David Telintelo Kalifa Telintelo Eden Prairie (MN),Eden Prairie (MN),3445.0,True,
usajigsaw,usajpa_2025_pairs,2025,pairs,final,1000,7200,95,Agnes Roche Catriona Paul Jersey City (New Jersey),Jersey City (New Jersey),3465.0,True,
usajigsaw,usajpa_2025_pairs,2025,pairs,final,1000,7200,96,Chloe Muellers Anna Fomina Monterey (MA) / Red Bluff (CA),Monterey (MA) / Red Bluff (CA),3473.0,True,
usajigsaw,usajpa_2025_pairs,2025,pairs,final,1000,7200,97,Kimberly Kenne Liza Fireman Pasadena (California) / Bellevue (Washington),Pasadena (California) / Bellevue (Washington),3478.0,True,
usajigsaw,usajpa_2025_pairs,2025,pairs,final,1000,7200,98,Kelley Vallecillo Stephanie O’Donnell Herndon (Virginia),Herndon (Virginia),3482.0,True,
usajigsaw,usajpa_2025_pairs,2025,pairs,final,1000,7200,99,Amanda Van Straten Colleen Morris Saint Johnsbury (VT),Saint Johnsbury (VT),3484.0,True,
usajigsaw,usajpa_2025_pairs,2025,pairs,final,1000,7200,100,Erin Fisk Mary Powell Portland (Or),Portland (Or),3505.0,True,
usajigsaw,usajpa_2025_pairs,2025,pairs,final,1000,7200,101,Michelle Micheli Kasey Smith Sterling (VA),Sterling (VA),3507.0,True,
usajigsaw,usajpa_2025_pairs,2025,pairs,final,1000,7200,102,Katherine Sydor Colleen Campbell Washington (DC) / Hyattsville (MD),Washington (DC) / Hyattsville (MD),3511.0,True,
usajigsaw,usajpa_2025_pairs,2025,pairs,final,1000,7200,103,Katie Ruberg Alayna Ruberg Byron Center (MI),Byron Center (MI),3519.0,True,
usajigsaw,usajpa_2025_pairs,2025,pairs,final,1000,7200,104,Karen Wells Jessica Bradley Colorado Springs (Co) / Monument (CO),Colorado Springs (Co) / Monument (CO),3532.0,True,
usajigsaw,usajpa_2025_pairs,2025,pairs,final,1000,7200,105,Kara Bingham Karen Gregory Midland (Michigan) / Northville (Mi),Midland (Michigan) / Northville (Mi),3539.0,True,
usajigsaw,usajpa_2025_pairs,2025,pairs,final,1000,7200,106,Erin Ireland Jessica Rykowski Vestal (NY),Vestal (NY),3559.0,True,
usajigsaw,usajpa_2025_pairs,2025,pairs,final,1000,7200,107,Hope Thompson Carrie Campbell Hurst (TX) / Denton (TX),Hurst (TX) / Denton (TX),3566.0,True,
usajigsaw,usajpa_2025_pairs,2025,pairs,final,1000,7200,107,Victoria Colfer Jacqueline Hawkins Irwin (PA),Irwin (PA),3566.0,True,
usajigsaw,usajpa_2025_pairs,2025,pairs,final,1000,7200,109,Alyssa Graham Selina Gilbertson Phoenix (AZ) / Mesa (Arizona),Phoenix (AZ) / Mesa (Arizona),3571.0,True,
usajigsaw,usajpa_2025_pairs,2025,pairs,final,1000,7200,110,Tara Griffitts Brian Wolfe Camas (Washington),Camas (Washington),3585.0,True,
usajigsaw,usajpa_2025_pairs,2025,pairs,final,1000,7200,111,Helen Hu Taigen O San Jose (California),San Jose (California),3588.0,True,
usajigsaw,usajpa_2025_pairs,2025,pairs,final,1000,7200,112,Taylor Reed Cecilia Frew Rolla (MO) / St Louis (MO),Rolla (MO) / St Louis (MO),3590.0,True,
usajigsaw,usajpa_2025_pairs,2025,pairs,final,1000,7200,113,Erin Cherry Sarah Proctor Gloucester (MA) / Deerfield (NH),Gloucester (MA) / Deerfield (NH),3598.0,True,
usajigsaw,usajpa_2025_pairs,2025,pairs,final,1000,7200,114,Heather Ross Shannon Richardson Torrance (Ca),Torrance (Ca),3601.0,True,
usajigsaw,usajpa_2025_pairs,2025,pairs,final,1000,7200,115,Krystal Cotriss Luanne Hill Glen Burnie (Md) / Boyds (MD),Glen Burnie (Md) / Boyds (MD),3602.0,True,
usajigsaw,usajpa_2025_pairs,2025,pairs,final,1000,7200,116,Lindsey Anderson Peggy Brown - / Severn (MD),- / Severn (MD),3604.0,True,
usajigsaw,usajpa_2025_pairs,2025,pairs,final,1000,7200,117,Bill McFadden Brooke Ouro-Djobo Stoughton (MA),Stoughton (MA),3608.0,True,
usajigsaw,usajpa_2025_pairs,2025,pairs,final,1000,7200,117,Rushing Smith III Jenevieve Parker Hideaway (TX),Hideaway (TX),3608.0,True,
usajigsaw,usajpa_2025_pairs,2025,pairs,final,1000,7200,119,Kirsty Weitzel Leila Beikmohamadi Efland (NC),Efland (NC),3619.0,True,
usajigsaw,usajpa_2025_pairs,2025,pairs,final,1000,7200,120,Michael Ha Jay Ritch (Washington) / Washington (DC),(Washington) / Washington (DC),3621.0,True,
usajigsaw,usajpa_2025_pairs,2025,pairs,final,1000,7200,121,Aimee Seligstein Chelsea Widmaier Washington (DC) / Gaithersburg (Md),Washington (DC) / Gaithersburg (Md),3633.0,True,
usajigsaw,usajpa_2025_pairs,2025,pairs,final,1000,7200,122,Tyler Heathcote Mallika Venkatachalam New York (NY),New York (NY),3639.0,True,
usajigsaw,usajpa_2025_pairs,2025,pairs,final,1000,7200,123,Shannon O’Hara Todd O’Hara Milwaukee (Wi),Milwaukee (Wi),3644.0,True,
usajigsaw,usajpa_2025_pairs,2025,pairs,final,1000,7200,124,Jensy Nandar Bejarano Isabel Urrutia Boyacá / Waterloo (Ontario),Boyacá / Waterloo (Ontario),3658.0,True,
usajigsaw,usajpa_2025_pairs,2025,pairs,final,1000,7200,125,Melissa Martin Jodi Green North Syracuse (NY) / Arlington (MA),North Syracuse (NY) / Arlington (MA),3666.0,True,
usajigsaw,usajpa_2025_pairs,2025,pairs,final,1000,7200,126,Christine Parsons Ann Marie Greenleaf Kittery (maine),Kittery (maine),3673.0,True,
usajigsaw,usajpa_2025_pairs,2025,pairs,final,1000,7200,126,Tessa Melli Gabby Melli Longmont (CO),Longmont (CO),3673.0,True,
usajigsaw,usajpa_2025_pairs,2025,pairs,final,1000,7200,126,Kristen Sweeney Erin Sweeney Atlanta (GA) / Newark (NJ),Atlanta (GA) / Newark (NJ),3673.0,True,
usajigsaw,usajpa_2025_pairs,2025,pairs,final,1000,7200,126,Madeleine Tejeda Pedrow Lydia Osner Landenberg (Pennsylvania),Landenberg (Pennsylvania),3673.0,True,
usajigsaw,usajpa_2025_pairs,2025,pairs,final,1000,7200,126,Sarah Hosley Julia Winer Bloomfiled (CT) / West Hartford (CT),Bloomfiled (CT) / West Hartford (CT),3673.0,True,
usajigsaw,usajpa_2025_pairs,2025,pairs,final,1000,7200,131,Joyce Yoo Emily McInnes Las Vegas (NV) / Queensland,Las Vegas (NV) / Queensland,3682.0,True,
usajigsaw,usajpa_2025_pairs,2025,pairs,final,1000,7200,132,Laresa Meadows Lynsie Stephens Washington,Washington,3708.0,True,
usajigsaw,usajpa_2025_pairs,2025,pairs,final,1000,7200,133,Jennifer Morrow Bailey Baleno Vestal (NY),Vestal (NY),3717.0,True,
usajigsaw,usajpa_2025_pairs,2025,pairs,final,1000,7200,134,Michelle Abbott Casey Abbott Columbia (TN),Columbia (TN),3718.0,True,
usajigsaw,usajpa_2025_pairs,2025,pairs,final,1000,7200,135,Amber Spires Rita Loeffler Delaware (Oh) / Columbus (OH),Delaware (Oh) / Columbus (OH),3720.0,True,
usajigsaw,usajpa_2025_pairs,2025,pairs,final,1000,7200,136,Curt Schleler Ben Scofield Washington (DC) / Durham (NC),Washington (DC) / Durham (NC),3721.0,True,
usajigsaw,usajpa_2025_pairs,2025,pairs,final,1000,7200,137,Clare Kay Jennifer Hancock San Francisco (CA),San Francisco (CA),3729.0,True,
usajigsaw,usajpa_2025_pairs,2025,pairs,final,1000,7200,138,Rose Robbins Leah Robbins Portland (Or),Portland (Or),3742.0,True,
usajigsaw,usajpa_2025_pairs,2025,pairs,final,1000,7200,139,Sarah Rowe Abigail Bertelson Williamstown (Massachusetts),Williamstown (Massachusetts),3753.0,True,
usajigsaw,usajpa_2025_pairs,2025,pairs,final,1000,7200,140,Amanda Herman Julianna Duke Stephens City (VA),Stephens City (VA),3756.0,True,
usajigsaw,usajpa_2025_pairs,2025,pairs,final,1000,7200,141,Hannah Blackburn Alex Cecil Chapel Hill (NC),Chapel Hill (NC),3766.0,True,
usajigsaw,usajpa_2025_pairs,2025,pairs,final,1000,7200,142,Rebecca Tsang Tiffany Kang Chicago (IL),Chicago (IL),3777.0,True,
usajigsaw,usajpa_2025_pairs,2025,pairs,final,1000,7200,143,Trish Doty Jessica Stewart Harrisburg (PA) / New Cumberland (PA),Harrisburg (PA) / New Cumberland (PA),3778.0,True,
usajigsaw,usajpa_2025_pairs,2025,pairs,final,1000,7200,144,Lori Eich Jennie Zumbusch Los Angeles (California) / Arnolds Park (IA),Los Angeles (California) / Arnolds Park (IA),3807.0,True,
usajigsaw,usajpa_2025_pairs,2025,pairs,final,1000,7200,145,Felisa Lewis Jessica Crosby Potomac (Maryland) / Myrtle Beach (SC),Potomac (Maryland) / Myrtle Beach (SC),3814.0,True,
usajigsaw,usajpa_2025_pairs,2025,pairs,final,1000,7200,146,Laura Parker Kimberly Williamson Atlanta (GA),Atlanta (GA),3825.0,True,
usajigsaw,usajpa_2025_pairs,2025,pairs,final,1000,7200,147,Ariana Murphy Ariel Friedman Berryville (Virginia),Berryville (Virginia),3834.0,True,
usajigsaw,usajpa_2025_pairs,2025,pairs,final,1000,7200,147,Karin Veatch Evan Veatch Carmel (IN),Carmel (IN),3834.0,True,
usajigsaw,usajpa_2025_pairs,2025,pairs,final,1000,7200,149,Laurie Marcey Vany Nguyen Cary (NC) / San Diego (Ca),Cary (NC) / San Diego (Ca),3871.0,True,
usajigsaw,usajpa_2025_pairs,2025,pairs,final,1000,7200,150,Ashley Tucker Mallory Leonard Festus (MO),Festus (MO),3881.0,True,
usajigsaw,usajpa_2025_pairs,2025,pairs,final,1000,7200,151,Jodie Morse Jen McGuire Ct / New Fairfield (CT),Ct / New Fairfield (CT),3886.0,True,
usajigsaw,usajpa_2025_pairs,2025,pairs,final,1000,7200,152,Jonathan Cluff Cleo van der Veen Ransom Canyon (Texas) / Phoenix (Arizona),Ransom Canyon (Texas) / Phoenix (Arizona),3892.0,True,
usajigsaw,usajpa_2025_pairs,2025,pairs,final,1000,7200,153,Kim Knaub Tresia White Loup City (NE),Loup City (NE),3904.0,True,
usajigsaw,usajpa_2025_pairs,2025,pairs,final,1000,7200,154,Courtney Buhler Ameenah Saafir Noblesville (IN) / Canton (Michigan),Noblesville (IN) / Canton (Michigan),3906.0,True,
usajigsaw,usajpa_2025_pairs,2025,pairs,final,1000,7200,155,Matthew Swanson Megan Swanson San Francisco (CA),San Francisco (CA),3913.0,True,
usajigsaw,usajpa_2025_pairs,2025,pairs,final,1000,7200,156,David Black Jonathan Armstrong vancouver (wa),vancouver (wa),3928.0,True,
usajigsaw,usajpa_2025_pairs,2025,pairs,final,1000,7200,157,Taylor Luse Lina Patton Los Angeles (CA),Los Angeles (CA),3941.0,True,
usajigsaw,usajpa_2025_pairs,2025,pairs,final,1000,7200,158,Sarah Mackey Michelle Penta West Hartford (Connecticut) / South Windsor (CT),West Hartford (Connecticut) / South Windsor (CT),3977.0,True,
usajigsaw,usajpa_2025_pairs,2025,pairs,final,1000,7200,159,Linda Hirschfeld Jessica Cutshall Auburn (IN),Auburn (IN),4004.0,True,
usajigsaw,usajpa_2025_pairs,2025,pairs,final,1000,7200,160,Michelle Durkin Peyton Durkin Wellesley (Massachusetts),Wellesley (Massachusetts),4016.0,True,
usajigsaw,usajpa_2025_pairs,2025,pairs,final,1000,7200,161,Kevin Collins Addy Anderson Flint (MI),Flint (MI),4023.0,True,
usajigsaw,usajpa_2025_pairs,2025,pairs,final,1000,7200,162,Owen Wartella Jennifer Lam Somerville (Massachusetts),Somerville (Massachusetts),4073.0,True,
usajigsaw,usajpa_2025_pairs,2025,pairs,final,1000,7200,163,Lisa Weaver Michelle Kaufman Wildwood (MO),Wildwood (MO),4088.0,True,
usajigsaw,usajpa_2025_pairs,2025,pairs,final,1000,7200,164,Rachel Didonna Avery Nagle Bloomfield (Connecticut) / Elkridge (Maryland),Bloomfield (Connecticut) / Elkridge (Maryland),4091.0,True,
usajigsaw,usajpa_2025_pairs,2025,pairs,final,1000,7200,165,Elizabeth Dukette Stephan Polsdofer Richmond (Virginia) / Montgomery Village (Md),Richmond (Virginia) / Montgomery Village (Md),4097.0,True,
usajigsaw,usajpa_2025_pairs,2025,pairs,final,1000,7200,165,Natalie Davies Kacey Meaker Alexandria (VA),Alexandria (VA),4097.0,True,
