source,event_id,year,division,round,puzzle_pieces,time_limit_seconds,rank,competitor_name,origin,time_seconds,completed,pieces_completed
usajigsaw,usajpa_2025_pairs,2025,pairs,final,1000,7200,167,Natasha Oerter Audriana Oerter Belle Plains Dr (Va),Belle Plains Dr (Va),4100.0,True,
usajigsaw,usajpa_2025_pairs,2025,pairs,final,1000,7200,168,Nhi Nguyen Kim Alvarez Houston (Tx),Houston (Tx),4128.0,True,
usajigsaw,usajpa_2025_pairs,2025,pairs,final,1000,7200,169,Rachel Sears Gloria O’Meara Falmoutb (Me),Falmoutb (Me),4137.0,True,
usajigsaw,usajpa_2025_pairs,2025,pairs,final,1000,7200,170,Mary Ann Alwan Kristen Born Dana Point (CA) / San Clemente (CA),Dana Point (CA) / San Clemente (CA),4141.0,True,
usajigsaw,usajpa_2025_pairs,2025,pairs,final,1000,7200,171,Angie Gazdic Emma Landgraf Chicago (IL),Chicago (IL),4143.0,True,
usajigsaw,usajpa_2025_pairs,2025,pairs,final,1000,7200,172,Soren Hansen Anna Kogut Arlington (VA),Arlington (VA),4155.0,True,
usajigsaw,usajpa_2025_pairs,2025,pairs,final,1000,7200,173,Tazia Statucki Jenna Mikish Washington (Dc),Washington (Dc),4174.0,True,
usajigsaw,usajpa_2025_pairs,2025,pairs,final,1000,7200,174,Kate Crocker Gretchen Steen Saint Johnsbury (VT),Saint Johnsbury (VT),4178.0,True,
usajigsaw,usajpa_2025_pairs,2025,pairs,final,1000,7200,175,Sarah Eggerichs Beth Clement Rockford (Míchigan),Rockford (Míchigan),4195.0,True,
usajigsaw,usajpa_2025_pairs,2025,pairs,final,1000,7200,176,Kinsey Keltz Rachel Gaskin Carrollton (Tx) / Arlington (Texas),Carrollton (Tx) / Arlington (Texas),4220.0,True,
usajigsaw,usajpa_2025_pairs,2025,pairs,final,1000,7200,177,Rebecca Widmayer Danielle Swales Apex (Nc) / Durham (NC),Apex (Nc) / Durham (NC),4246.0,True,
usajigsaw,usajpa_2025_pairs,2025,pairs,final,1000,7200,178,Yasmeen Almog Daniel Almog Jackson Hole (Wyoming) / Menlo Park (CA),Jackson Hole (Wyoming) / Menlo Park (CA),4260.0,True,
usajigsaw,usajpa_2025_pairs,2025,pairs,final,1000,7200,179,Alex Carney Dever Kucera California,California,4261.0,True,
usajigsaw,usajpa_2025_pairs,2025,pairs,final,1000,7200,180,Brandon Harrington Feifei Xue San Francisco (CA),San Francisco (CA),4275.0,True,
usajigsaw,usajpa_2025_pairs,2025,pairs,final,1000,7200,181,Lisa Schuler Samantha Dahlke Mounds View (MN) / Maple Grove (Minnesota),Mounds View (MN) / Maple Grove (Minnesota),4290.0,True,
usajigsaw,usajpa_2025_pairs,2025,pairs,final,1000,7200,181,Robyn Curtis Diana Oorzhak Tacoma (WA),Tacoma (WA),4290.0,True,
usajigsaw,usajpa_2025_pairs,2025,pairs,final,1000,7200,183,Hana Johnstone Cami Pottle Chicago (Illinois),Chicago (Illinois),4300.0,True,
usajigsaw,usajpa_2025_pairs,2025,pairs,final,1000,7200,184,Stephanie Owen Debbie Owen Charlottesville (Virginia),Charlottesville (Virginia),4335.0,True,
usajigsaw,usajpa_2025_pairs,2025,pairs,final,1000,7200,185,Jamie Wimmer Corey Hasty Olive Branch (MS),Olive Branch (MS),4382.0,True,
usajigsaw,usajpa_2025_pairs,2025,pairs,final,1000,7200,186,Michelle Malcom Aurali Dade Warrenton (VA),Warrenton (VA),4394.0,True,
usajigsaw,usajpa_2025_pairs,2025,pairs,final,1000,7200,187,Michael Dickman Dylan Dickman Aurora (CO),Aurora (CO),4422.0,True,
usajigsaw,usajpa_2025_pairs,2025,pairs,final,1000,7200,188,Carolyn Papke Chad Papke Falls Church (Va) / McLean (Virgina),Falls Church (Va) / McLean (Virgina),4428.0,True,
usajigsaw,usajpa_2025_pairs,2025,pairs,final,1000,7200,189,Jennifer Hill Manja Wurschke Columbia (Pensilvania) / Stamford (CT),Columbia (Pensilvania) / Stamford (CT),4463.0,True,
usajigsaw,usajpa_2025_pairs,2025,pairs,final,1000,7200,190,Jamie Ambabo Luna Ambabo Decatur (Ga),Decatur (Ga),4546.0,True,
usajigsaw,usajpa_2025_pairs,2025,pairs,final,1000,7200,191,Jason Adams Emma Adams Mt. Juliet (Tn),Mt. Juliet (Tn),4587.0,True,
usajigsaw,usajpa_2025_pairs,2025,pairs,final,1000,7200,192,Robin Patrick Ashley Willard Durham (NC),Durham (NC),4666.0,True,
usajigsaw,usajpa_2025_pairs,2025,pairs,final,1000,7200,193,Norah Molina Ted Desmaisons California / Daly City (CA),California / Daly City (CA),4678.0,True,
usajigsaw,usajpa_2025_pairs,2025,pairs,final,1000,7200,194,Sakara Perry Catherine Kieu Seattle (WA),Seattle (WA),4692.0,True,
usajigsaw,usajpa_2025_pairs,2025,pairs,final,1000,7200,195,Mollie Tessler Maggie Horne White Plains (NY) / North Salem (NY),White Plains (NY) / North Salem (NY),4700.0,True,
usajigsaw,usajpa_2025_pairs,2025,pairs,final,1000,7200,196,Kori Klustaitis Brittany Nixon Cary (NC),Cary (NC),4743.0,True,
usajigsaw,usajpa_2025_pairs,2025,pairs,final,1000,7200,197,Bonnie Rightnour Julie Schriver Montpelier (VA),Montpelier (VA),4839.0,True,
usajigsaw,usajpa_2025_pairs,2025,pairs,final,1000,7200,198,Kettie Olsen Aubrey Keisel Aurora (Colorado),Aurora (Colorado),4857.0,True,
usajigsaw,usajpa_2025_pairs,2025,pairs,final,1000,7200,199,Joe Feehan Billy Weaver Washington (Dc) / Chantilly (VA),Washington (Dc) / Chantilly (VA),5271.0,True,
usajigsaw,usajpa_2025_teams,2025,teams,final,2000,10800,1,Jack Be Quick Jeanne Roiter  /  Cathy Roiter  /  Andrea Peng  /  Kelly Walter Duvall,Duvall,5873.0,True,
usajigsaw,usajpa_2025_teams,2025,teams,final,2000,10800,2,Jiggernauts Jessa Douglas  /  Kelly Buhr  /  Hannah Scott  /  Alice Rowe Centralia,Centralia,6277.0,True,
usajigsaw,usajpa_2025_teams,2025,teams,final,2000,10800,3,Three And A Half Men Kyle Kossin  /  Mathew Nettlow  /  Josh Trauger  /  Conner DeLaat Bountiful,Bountiful,6285.0,True,
usajigsaw,usajpa_2025_teams,2025,teams,final,2000,10800,4,We Put The ’Betch’ In You Betcha Sarah Schuler  /  Lauren Kautz  /  Andrea Kyle  /  Dawne Rasmusson Saint Paul,Saint Paul,6499.0,True,
usajigsaw,usajpa_2025_teams,2025,teams,final,2000,10800,5,Wicked Quick Emily Chandran  /  Mari Black  /  Emma Pan  /  Sammy Brownlow Cambridge MA,Cambridge MA,6552.0,True,
usajigsaw,usajpa_2025_teams,2025,teams,final,2000,10800,6,Girls In Stemp Chloe Glikbarg / Skye Vandeleest / Kaitlyn McCluskie / Hannah Doyle Santa Barbara,Santa Barbara,6634.0,True,
usajigsaw,usajpa_2025_teams,2025,teams,final,2000,10800,7,Puzzle Ostriches Andrea Heistand / Allie Arendell / Elizabeth Caron / Michaela Keener Muskegon,Muskegon,6721.0,True,
usajigsaw,usajpa_2025_teams,2025,teams,final,2000,10800,8,"Flip, Sort, Cry Tiffany Medeiros  /  Katherine Dilks  /  Grey Rogers  /  Simmie Berman Lowell",Lowell,7430.0,True,
usajigsaw,usajpa_2025_teams,2025,teams,final,2000,10800,9,Random Cuts Elizabeth Forsyth  /  Helen Hu  /  Caroline Orsi  /  Christopher Nammour San Francisco,San Francisco,8235.0,True,
usajigsaw,usajpa_2025_teams,2025,teams,final,2000,10800,10,War And Piece (Ca) Yvonne Feucht  /  Alyssa Zackler  /  Tammy McLeod  /  Lindsay Steenstra Burbank,Burbank,8262.0,True,
usajigsaw,usajpa_2025_teams,2025,teams,final,2000,10800,11,Flippin’ Edgy Owen Wartella  /  Jennifer Lam  /  Annabelle Platt  /  Emma Williamson Somerville,Somerville,8414.0,True,
usajigsaw,usajpa_2025_teams,2025,teams,final,2000,10800,12,Where’S That One Piece? Caryn Knill  /  Jessica Graber  /  Calie Curran  /  Kelsi Cook St. Augustine,St. Augustine,8434.0,True,
usajigsaw,usajpa_2025_teams,2025,teams,final,2000,10800,13,Odd Birds Elizabeth McElveen  /  Jasper Lee  /  Min-Yee Deng  /  Jamie Ambabo Greenville,Greenville,8478.0,True,
usajigsaw,usajpa_2025_teams,2025,teams,final,2000,10800,14,That’S So Ravensburger Diana Jaffe  /  Anne Marie Barrette  /  Iryna Shvydchenko  /  Rachael Schachtler Washington,Washington,8550.0,True,
usajigsaw,usajpa_2025_teams,2025,teams,final,2000,10800,15,Blue Dust Bunnies Karen Ni  /  Carmen Dueñas  /  Trisha Siedlecki  /  Xin Li Phuah Diamond Bar,Diamond Bar,8616.0,True,
usajigsaw,usajpa_2025_teams,2025,teams,final,2000,10800,16,So Much Flippin’ Work Margaret Long  /  Kayla Berkowitz  /  Jasmine Butcher  /  Tally Klinefelter Duluth,Duluth,8740.0,True,
usajigsaw,usajpa_2025_teams,2025,teams,final,2000,10800,17,Puzzleco Jennifer Sipple  /  Claire Thomas  /  Whitney Presley  /  Sydney Richards Denver,Denver,8783.0,True,
usajigsaw,usajpa_2025_teams,2025,teams,final,2000,10800,18,"Cherry Blossom Challengers Eric Goulet  /  Lindsay Wang  /  Jane Stine  /  Jenna Wyly Washington, Dc","Washington, Dc",8800.0,True,
usajigsaw,usajpa_2025_teams,2025,teams,final,2000,10800,19,Pieces Of Cake Gail McCormick  /  Maud Dias  /  Megan Jones  /  Melinda Whiting State College,State College,8875.0,True,
usajigsaw,usajpa_2025_teams,2025,teams,final,2000,10800,20,Queen City Puzzlers Edith Lewis  /  Sarah Craig  /  Carley lauer  /  Jason Pipkin Cincinnati,Cincinnati,8917.0,True,
usajigsaw,usajpa_2025_teams,2025,teams,final,2000,10800,21,Subway Solvers Elizaveta Gallagher  /  Ashlyn Koga  /  Anna Workman  /  Samantha Ramsey Brooklyn,Brooklyn,8922.0,True,
usajigsaw,usajpa_2025_teams,2025,teams,final,2000,10800,22,Pocket Full Of Pieces Aloysia Larson / Emmie Lee / Elizabeth Nelson / Joshua Nelson Moorhead,Moorhead,9028.0,True,
usajigsaw,usajpa_2025_teams,2025,teams,final,2000,10800,23,Moderately Puzzled Grace Byrnes  /  Marguerite Byrnes  /  Nathan Biberdorf  /  Nicholas Ebelhack Everett,Everett,9166.0,True,
usajigsaw,usajpa_2025_teams,2025,teams,final,2000,10800,24,"Floor Check Sophie Figura  /  Kory Figura  /  Max Figura  /  Zeb Figura Waverly, IA","Waverly, IA",9338.0,True,
usajigsaw,usajpa_2025_teams,2025,teams,final,2000,10800,25,Distant Connections Timothy Miller  /  Sarah Goodman  /  Kristin Jimenez  /  Melissa Harlow New York,New York,9397.0,True,
usajigsaw,usajpa_2025_teams,2025,teams,final,2000,10800,26,Bbq Hotdish Alexx Cisotto  /  Amy Paull  /  Jessica Derby  /  Liz Walters Houston,Houston,9537.0,True,
usajigsaw,usajpa_2025_teams,2025,teams,final,2000,10800,27,"Puzzle, In A Good Way Betsey English  /  Brenna Kitchen  /  Jodi Nichol  /  Karen Gwilliam Clinton",Clinton,9622.0,True,
usajigsaw,usajpa_2025_teams,2025,teams,final,2000,10800,28,Stuck Together Lindsey Anderson  /  Peggy Brown  /  Amber Whitear  /  Shalise Hassing Orem,Orem,9649.0,True,
usajigsaw,usajpa_2025_teams,2025,teams,final,2000,10800,29,Your Favorite Puzzler’S Favorite Puzzlers Jessica Henderson  /  Nicholas Mueller  /  Christine Durkin  /  Meredith Yeager Henderson,Henderson,9655.0,True,
usajigsaw,usajpa_2025_teams,2025,teams,final,2000,10800,30,"Cravin’ For Raven Larry Blanck  /  Meri Cartee  /  Liza Fireman  /  Kimberly Kenne Warminster, PA","Warminster, PA",9671.0,True,
usajigsaw,usajpa_2025_teams,2025,teams,final,2000,10800,31,Los Ravensburritos Andrew Bradburn  /  Yuewen Chun  /  Darya Leylian  /  Elizabeth Tashiro North Hollywood,North Hollywood,9679.0,True,
usajigsaw,usajpa_2025_teams,2025,teams,final,2000,10800,32,"Puzzle Quartet Agnes Roche   /   Catriona Paul   /   Sarah Rowe   /   Anjali Suresh Jersey City, NJ","Jersey City, NJ",9746.0,True,
usajigsaw,usajpa_2025_teams,2025,teams,final,2000,10800,33,The Joy Of Puzzling Meagan Brucker-Hahn  /  Noelle Marshall  /  Jeremy Seidling  /  Kara Taylor Ann Arbor,Ann Arbor,9754.0,True,
usajigsaw,usajpa_2025_teams,2025,teams,final,2000,10800,34,Dammit Fit! Cosmo Smith  /  Leslie Richardson  /  Emilee Frost  /  Ashley Wu Seattle,Seattle,9762.0,True,
usajigsaw,usajpa_2025_teams,2025,teams,final,2000,10800,35,Purple Puzzle People Melynda Owens  /  Jessica Musser  /  Kinsey Keltz  /  Rachel Gaskin Hurst,Hurst,9843.0,True,
usajigsaw,usajpa_2025_teams,2025,teams,final,2000,10800,36,The Kincardine Kate Yee  /  Anna Pogharian  /  Gina Talcott  /  Nick Thumma Evanston,Evanston,9875.0,True,
usajigsaw,usajpa_2025_teams,2025,teams,final,2000,10800,37,Are You My Dad? Bethany Litus  /  Alex Anderson  /  Justin Litus  /  Amanda Mittelman Pittsburgh,Pittsburgh,9947.0,True,
usajigsaw,usajpa_2025_teams,2025,teams,final,2000,10800,38,Beam Beatrice Endler  /  Erin Fisk  /  Alicia Gould  /  Mary Powell Portland,Portland,10003.0,True,
usajigsaw,usajpa_2025_teams,2025,teams,final,2000,10800,39,"Procrastinating Puzzlers Jessica Streitz  /  Rebecca Streitz  /  Katrina Pieplow  /  Caleb Pieplow Washington, DC","Washington, DC",10061.0,True,
usajigsaw,usajpa_2025_teams,2025,teams,final,2000,10800,40,Just Gonna Squeeze Right Past Ya Alison Filley  /  Andrea Reynolds  /  Erin Sweeney  /  Kristen Sweeney Iowa City,Iowa City,10097.0,True,
usajigsaw,usajpa_2025_teams,2025,teams,final,2000,10800,41,Pieceful Warriors Taylor Reed / Cecilia Frew / Maria Seitz / Rose Barrett Springfield,Springfield,10120.0,True,
usajigsaw,usajpa_2025_teams,2025,teams,final,2000,10800,42,Chicago Puzzle Club Shirley Jiang  /  Frank Lieu  /  Elizabeth Alvarez  /  Maddie Bouchie Chicago,Chicago,10311.0,True,
usajigsaw,usajpa_2025_teams,2025,teams,final,2000,10800,43,Dc Piecemakers Aimee Seligstein  /  Chelsea Widmaier  /  Krystal Cotriss  /  Tazia Statucki Washington DC,Washington DC,10466.0,True,
usajigsaw,usajpa_2025_teams,2025,teams,final,2000,10800,44,Puzzle Sharks Jonathan Armstrong  /  David Black  /  Maggie Kirkland  /  Marisa Martin Vancouver,Vancouver,10603.0,True,
usajigsaw,usajpa_2025_teams,2025,teams,final,2000,10800,45,Virginia Puzzlers Amanda Herman  /  Julianna Duke  /  Natalie Schimmelbusch  /  Elizabeth Sondag Stephens City,Stephens City,10670.0,True,
usajigsaw,usajpa_2025_teams,2025,teams,final,2000,10800,46,Carolina Snapdragons Jen Lunsford  /  Kirsty Weitzel  /  Sabrina Monserate-Lindsay  /  Leila Beikmohamadi Efland,Efland,10721.0,True,
usajigsaw,usajpa_2025_teams,2025,teams,final,2000,10800,47,Edge Of Glory Ashley Bromiley  /  Felisa Lewis  /  Jessica Crosby  /  Soon Kim Union City,Union City,10736.0,True,
usajigsaw,usajpa_2025_teams,2025,teams,final,2000,10800,48,Lowcal Calzone Zone Gabrielle Melli  /  Tessa Melli  /  Kristin Blair  /  Sarah Hauge Denver,Denver,,False,1977.0
usajigsaw,usajpa_2025_teams,2025,teams,final,2000,10800,49,Empire State Tessallators Jennifer Morrow  /  Bailey Baleno  /  Erin Ireland  /  Jessica Rykowski Vestal,Vestal,,False,1962.0
usajigsaw,usajpa_2025_teams,2025,teams,final,2000,10800,50,Puzzle Pisces Joe Feehan  /  Billy Weaver  /  Michael Ha  /  Jay Ritch Washington,Washington,,False,1943.0
usajigsaw,usajpa_2025_teams,2025,teams,final,2000,10800,51,Jigsaw Junkies (In) Kylie Ledingham  /  Misty Ledingham  /  Krinda Hie  /  Kelly Pryor Carmel,Carmel,,False,1901.0
usajigsaw,usajpa_2025_teams,2025,teams,final,2000,10800,52,Fit Happen! Bill McFadden  /  Brooke Ouro-Djobo  /  Erin Cherry  /  Sarah Proctor Stoughton,Stoughton,,False,1894.0
usajigsaw,usajpa_2025_teams,2025,teams,final,2000,10800,53,Puzzle Rizz Hiromi Kimura  /  Lena Nguyen-Vo  /  Chris Morrissey  /  Cami Pottle Lynnwood,Lynnwood,,False,1885.0
usajigsaw,usajpa_2025_teams,2025,teams,final,2000,10800,54,Puzzle Jiggle Giggle Fits Karen Wells  /  Jessica Bradley  /  Jessica Stewart  /  Kristin Squire Monument,Monument,,False,1880.0
usajigsaw,usajpa_2025_teams,2025,teams,final,2000,10800,55,Scatterbrains Alexandra Michonski  /  Caitlyn Helmore  /  Stephanie Owen  /  Debbie Owen Harrisonburg,Harrisonburg,,False,1870.0
usajigsaw,usajpa_2025_teams,2025,teams,final,2000,10800,56,Puzzlesotans Kevin Erickson  /  Katie Erickson  /  Laura Erickson  /  Ethan Falstrom Coon Rapids,Coon Rapids,,False,1869.0
usajigsaw,usajpa_2025_teams,2025,teams,final,2000,10800,57,Sizzle Pants Chelsea Suedkamp  /  Jessica Xiong  /  Liz Uram  /  Julie Kinn Fridley,Fridley,,False,1861.0
usajigsaw,usajpa_2025_teams,2025,teams,final,2000,10800,58,The Interstate Puzzlers Daniel Rodriguez  /  Valerie Espinosa  /  Toryn Schafer  /  Meg Craig Boulder,Boulder,,False,1858.0
usajigsaw,usajpa_2025_teams,2025,teams,final,2000,10800,59,Jigsaw Junction Jodie Morse  /  Jodi Green  /  Jen McGuire  /  Melissa Martin New London,New London,,False,1856.0
usajigsaw,usajpa_2025_teams,2025,teams,final,2000,10800,60,The Lnps: Ladies Night Puzzlers Karolina Kosakowska  /  Megan Hoban  /  Grace Chen  /  Emily Gombotz Medford,Medford,,False,1844.0
usajigsaw,usajpa_2025_teams,2025,teams,final,2000,10800,61,"The Dissectologists Michelle Chan  /  Kailee Chan  /  Jeff Klein  /  Gretchen Klein Houston, TX","Houston, TX",,False,1840.0
usajigsaw,usajpa_2025_teams,2025,teams,final,2000,10800,62,Mile High Middlers Michael Dickman  /  Dylan Dickman  /  Kettie Olsen  /  Aubrey Keisel Aurora,Aurora,,False,1837.0
usajigsaw,usajpa_2025_teams,2025,teams,final,2000,10800,63,Puzzle People Chloe Muellers / Michelle Philo / Jason Fox / Jennifer Cartel Monterey,Monterey,,False,1822.0
usajigsaw,usajpa_2025_teams,2025,teams,final,2000,10800,64,Penn Puzzlers Madeleine Tejeda Pedrow  /  Lydia Osner  /  Trish Doty  /  Jennifer Hill Landenberg,Landenberg,,False,1818.0
usajigsaw,usajpa_2025_teams,2025,teams,final,2000,10800,65,Flipping Awesome Joyce Yoo  /  Emily McInnes  /  Zoe Petitt  /  Luanne Hill Las Vegas,Las Vegas,,False,1816.0
usajigsaw,usajpa_2025_teams,2025,teams,final,2000,10800,66,Flash Piece Squad Karen Brownlow  /  Lori Nussbaum  /  Isabel Urrutia  /  Jensy Nandar Bejarano Seattle,Seattle,,False,1812.0
usajigsaw,usajpa_2025_teams,2025,teams,final,2000,10800,67,Ohio Is For Solvers Juli Logsdon  /  Amanda Collman  /  Ari Cotter  /  Michelle Parsons Grove City,Grove City,,False,1804.0
usajigsaw,usajpa_2025_teams,2025,teams,final,2000,10800,68,Snap It Like It’S Stick Season Amanda Van Straten  /  Kate Crocker  /  Gretchen Steen  /  Colleen Morris Saint Johnsbury,Saint Johnsbury,,False,1802.0
usajigsaw,usajpa_2025_teams,2025,teams,final,2000,10800,69,Bringing The Heat Alyssa Graham  /  Selina Gilbertson  /  Kenzie Graham  /  Kara Bancroft Phoenix,Phoenix,,False,1788.0
usajigsaw,usajpa_2025_teams,2025,teams,final,2000,10800,70,Wicked Puzzlers Christine Parsons  /  Ann Marie Greenleaf  /  Tulsi Mali  /  Himakshi Bhatt Kittery,Kittery,,False,1780.0
usajigsaw,usajpa_2025_teams,2025,teams,final,2000,10800,71,Frisbee Puzzlers Laurie Marcey  /  Vany Nguyen  /  Danielle Swales  /  Rebecca Widmayer Cary,Cary,,False,1779.0
usajigsaw,usajpa_2025_teams,2025,teams,final,2000,10800,72,"Lakes, Loons & Sweet Tea Katie Everson  /  Kara Bingham  /  Karen Gregory  /  Elizabeth Beetschen Plymouth",Plymouth,,False,1768.0
usajigsaw,usajpa_2025_teams,2025,teams,final,2000,10800,73,Easily Distracted By Puzzles Sarah Hosley / Sarah Mackey / Julia Winer / Michelle Penta West Hartford,West Hartford,,False,1761.0
usajigsaw,usajpa_2025_teams,2025,teams,final,2000,10800,74,Coast To Coast Crew Makiko Hiromi  /  Daniel Narain  /  Kristen Born  /  Mary Ann Alwan New York,New York,,False,1758.0
usajigsaw,usajpa_2025_teams,2025,teams,final,2000,10800,75,Puzzling Cat Ladies Mallory Roy  /  Kelsey Stiles  /  Ariana Murphy  /  Ariel Friedman Ashburn,Ashburn,,False,1757.0
usajigsaw,usajpa_2025_teams,2025,teams,final,2000,10800,76,The Ol’ Ruzzle Puzzle Kerry Nicholson  /  Valentina Chamorro  /  Maddie Kincaid  /  Alex Surick Cambridge,Cambridge,,False,1754.0
usajigsaw,usajpa_2025_teams,2025,teams,final,2000,10800,77,Get Jiggy Wit It Charese Gainor  /  Lauren Turner  /  Anna McElroy  /  Courtney Mense Bellingham,Bellingham,,False,1741.0
usajigsaw,usajpa_2025_teams,2025,teams,final,2000,10800,78,Piece Be With You Laura Parker  /  Kimberly Williamson  /  Claire Wlliamson  /  Olivia Frick Atlanta,Atlanta,,False,1732.0
usajigsaw,usajpa_2025_teams,2025,teams,final,2000,10800,78,Family Fun Time Doug Ellwanger  /  Jennie Ellwanger  /  Jay Ellwanger  /  Melanie Durland San Mateo,San Mateo,,False,1732.0
usajigsaw,usajpa_2025_teams,2025,teams,final,2000,10800,80,Border Patrol (Usa) Alisandra Jezek / Jd Dehne / Michelle Micheli / Kasey Smith Chesterfield,Chesterfield,,False,1723.0
usajigsaw,usajpa_2025_teams,2025,teams,final,2000,10800,81,Changing Corners Feifei Xue  /  Hung Nguyen  /  Sarah Fleming  /  Brandon Harrington San Francisco,San Francisco,,False,1716.0
usajigsaw,usajpa_2025_teams,2025,teams,final,2000,10800,82,Piece On The Ground Sami Heathcote  /  Megan Barwegan  /  Tyler Heathcote  /  Mallika Venkatachalam Greensboro,Greensboro,,False,1700.0
usajigsaw,usajpa_2025_teams,2025,teams,final,2000,10800,83,Living On The Edges Kim Knaub  /  Tresia White  /  Beverly Rice  /  Jenn Schauer Loup City,Loup City,,False,1693.0
usajigsaw,usajpa_2025_teams,2025,teams,final,2000,10800,84,Peppers And Prints Bethany Neyman  /  Cindy  /  Paula  /  Logan Arlington,Arlington,,False,1692.0
usajigsaw,usajpa_2025_teams,2025,teams,final,2000,10800,85,Patchwork Puzzlers My-Lea Coulombe-Quach  /  Lindsay Cooper  /  Maurice Werner  /  Abigail Savit Alexandria,Alexandria,,False,1688.0
usajigsaw,usajpa_2025_teams,2025,teams,final,2000,10800,86,Fit Happens (Mn) Lisa Schuler  /  Samantha Dahlke  /  Kate Amey  /  Jeff Amey Mounds View,Mounds View,,False,1666.0
usajigsaw,usajpa_2025_teams,2025,teams,final,2000,10800,86,Burrito Break Lori Eich  /  Jennie Zumbusch  /  Dan Hunt  /  Dan Kresowik Arnolds Park,Arnolds Park,,False,1666.0
usajigsaw,usajpa_2025_teams,2025,teams,final,2000,10800,86,Nor’Easters Mollie Tessler  /  Maggie Horne  /  Rachel Falk  /  Tanya Vattanasil North Salem,North Salem,,False,1666.0
usajigsaw,usajpa_2025_teams,2025,teams,final,2000,10800,89,The Puzzle Bums Rita Loeffler  /  Amber Spires  /  Amanda Hershberger  /  Betha Maust Columbus,Columbus,,False,1661.0
usajigsaw,usajpa_2025_teams,2025,teams,final,2000,10800,90,Puzz And Order: Special Jigsaw Unit Ameenah Saafir  /  Courtney Buhler  /  Diane Bizzle  /  Jessica Komarow Canton,Canton,,False,1657.0
usajigsaw,usajpa_2025_teams,2025,teams,final,2000,10800,91,The Tortured Puzzlers Department (Pa) Angela Harrow  /  Claire Murtha  /  BreAnna Gallegos  /  Allison Russotto Elkins Park,Elkins Park,,False,1651.0
usajigsaw,usajpa_2025_teams,2025,teams,final,2000,10800,92,Maryland Misfits Sara Mainwaring  /  Cory Mainwaring  /  Megan Royden  /  Linda Andrews Columbia,Columbia,,False,1638.0
usajigsaw,usajpa_2025_teams,2025,teams,final,2000,10800,93,It Takes All Sorts Diana Stanley  /  Brian Wolfe  /  Joni Sliger  /  Tara Griffits Portland,Portland,,False,1628.0
usajigsaw,usajpa_2025_teams,2025,teams,final,2000,10800,94,Advil Up! Rachel Shields  /  Rob Shields  /  Leah Robbins  /  Rose Robbins Portland,Portland,,False,1627.0
usajigsaw,usajpa_2025_teams,2025,teams,final,2000,10800,94,Cackalacky Chicks Ashley Willard  /  Robin Patrick  /  Brittany Nixon  /  Kori Klustaitis Durham,Durham,,False,1627.0
usajigsaw,usajpa_2025_teams,2025,teams,final,2000,10800,96,Puzz Kill (Usa) Faye Alleman  /  Natalie Hinkley  /  Debbie Thompson  /  Gloria Johnston Houston,Houston,,False,1597.0
usajigsaw,usajpa_2025_teams,2025,teams,final,2000,10800,97,Becky’S Birthday Bunch Sarah Barcousky  /  Danny Atyeo  /  Becky McCauley Rench  /  Lori Redman Orlando,Orlando,,False,1571.0
usajigsaw,usajpa_2025_teams,2025,teams,final,2000,10800,98,"Strangers To Solvers Carolyn Kuczmarski  /  Jeannette Huffman  /  Michelle Bone  /  Richard Stephen Uhler Independence, OH","Independence, OH",,False,1554.0
usajigsaw,usajpa_2025_teams,2025,teams,final,2000,10800,99,Last Minute Puzzlers (Usa) Kim Krapp  /  Sarah Pearson  /  Curt Schleler  /  Mackenzie Burnett Washington,Washington,,False,1506.0
usajigsaw,usajpa_2025_teams,2025,teams,final,2000,10800,100,Jiggy Stardust Angie Gazdic  /  Emma Landgraf  /  Cindy Clark  /  Komal Shah Chicago,Chicago,,False,1438.0
usajigsaw,usajpa_2024_individual,2024,individual,final,500,5400,1,Alice Rowe Boulder (CO),Boulder (CO),2352.0,True,
usajigsaw,usajpa_2024_individual,2024,individual,final,500,5400,2,Sarah Schuler St. Paul (Minnesota),St. Paul (Minnesota),2417.0,True,
usajigsaw,usajpa_2024_individual,2024,individual,final,500,5400,3,Lauren Kautz Minneapolis (Mn),Minneapolis (Mn),2473.0,True,
usajigsaw,usajpa_2024_individual,2024,individual,final,500,5400,4,Andrea Peng San Francisco (California),San Francisco (California),2484.0,True,
usajigsaw,usajpa_2024_individual,2024,individual,final,500,5400,5,Kelly Walter Phoenix (Arizona),Phoenix (Arizona),2573.0,True,
usajigsaw,usajpa_2024_individual,2024,individual,final,500,5400,6,Tiffany Medeiros Lowell (Massachusetts),Lowell (Massachusetts),2584.0,True,
usajigsaw,usajpa_2024_individual,2024,individual,final,500,5400,7,Jeanne Roiter Duvall (Washington),Duvall (Washington),2615.0,True,
usajigsaw,usajpa_2024_individual,2024,individual,final,500,5400,8,Cathy Roiter Duvall (Washington),Duvall (Washington),2650.0,True,
usajigsaw,usajpa_2024_individual,2024,individual,final,500,5400,9,Hanna Sigler Normal (IL),Normal (IL),2707.0,True,
usajigsaw,usajpa_2024_individual,2024,individual,final,500,5400,10,Kyle Kossin Bountiful (Utah),Bountiful (Utah),2721.0,True,
usajigsaw,usajpa_2024_individual,2024,individual,final,500,5400,11,Dawne Rasmusson Prior Lake (Minnesota),Prior Lake (Minnesota),2734.0,True,
usajigsaw,usajpa_2024_individual,2024,individual,final,500,5400,12,Hannah Scott Herndon (Virginia),Herndon (Virginia),2736.0,True,
usajigsaw,usajpa_2024_individual,2024,individual,final,500,5400,13,Abby Patnoe San Diego (California),San Diego (California),2750.0,True,
usajigsaw,usajpa_2024_individual,2024,individual,final,500,5400,14,Trisha Siedlecki Walnut (California),Walnut (California),2767.0,True,
usajigsaw,usajpa_2024_individual,2024,individual,final,500,5400,15,Yvonne Feucht Burbank (California),Burbank (California),2772.0,True,
usajigsaw,usajpa_2024_individual,2024,individual,final,500,5400,16,Mari Black Cambridge (Ma),Cambridge (Ma),2803.0,True,
usajigsaw,usajpa_2024_individual,2024,individual,final,500,5400,17,Simmie Berman Rockville (Maryland),Rockville (Maryland),2837.0,True,
usajigsaw,usajpa_2024_individual,2024,individual,final,500,5400,18,Katherine Dilks Haddonfield (New Jersey),Haddonfield (New Jersey),2841.0,True,
usajigsaw,usajpa_2024_individual,2024,individual,final,500,5400,19,Andrea Kyle Saint Paul (Minnesota),Saint Paul (Minnesota),2850.0,True,
usajigsaw,usajpa_2024_individual,2024,individual,final,500,5400,20,Emma Pan West Roxbury (Massachusetts),West Roxbury (Massachusetts),2868.0,True,
usajigsaw,usajpa_2024_individual,2024,individual,final,500,5400,21,Megan Jones Warwick (Ri),Warwick (Ri),2883.0,True,
usajigsaw,usajpa_2024_individual,2024,individual,final,500,5400,21,Elizabeth Caron Hartford (Connecticut),Hartford (Connecticut),2883.0,True,
